{
  "$schema": "https://json-schema.org/draft/2020-12/schema",
  "$id": "https://wasmagent.dev/schemas/aep/aep-record.schema.json",
  "title": "AEPRecord",
  "description": "Agent Evidence Protocol record — runtime action evidence and run provenance. Canonical source for wasmagent-js, wasmagent-proxy, trace-pipeline, wasmagent-train-replay, and open-agent-audit.",
  "type": "object",
  "required": [
    "schema_version",
    "run_id",
    "created_at_ms"
  ],
  "properties": {
    "schema_version": {
      "type": "string",
      "enum": [
        "aep/v0.1",
        "aep/v0.2",
        "aep/v0.3",
        "aep/v0.4",
        "aep/v0.5"
      ]
    },
    "run_id": {
      "type": "string"
    },
    "trace_id": {
      "type": "string"
    },
    "parent_trace_id": {
      "type": [
        "string",
        "null"
      ]
    },
    "repo_commit": {
      "type": "string"
    },
    "runtime_version": {
      "type": "string"
    },
    "model_provider": {
      "type": "string"
    },
    "model_id": {
      "type": "string"
    },
    "policy_bundle_digest": {
      "type": "string"
    },
    "tool_manifest_digest": {
      "type": "string"
    },
    "mcp_server_card_digest": {
      "type": [
        "string",
        "null"
      ]
    },
    "input_refs": {
      "type": "array",
      "items": {
        "type": "object",
        "required": [
          "uri"
        ],
        "properties": {
          "uri": {
            "type": "string"
          },
          "digest": {
            "type": "string"
          },
          "taint_labels": {
            "type": "array",
            "items": {
              "type": "string"
            }
          }
        }
      }
    },
    "output_refs": {
      "type": "array",
      "items": {
        "type": "object",
        "required": [
          "uri"
        ],
        "properties": {
          "uri": {
            "type": "string"
          },
          "digest": {
            "type": "string"
          },
          "redaction_profile": {
            "type": "string"
          }
        }
      }
    },
    "capability_decisions": {
      "type": "array",
      "items": {
        "type": "object",
        "required": [
          "capability",
          "subject",
          "resource",
          "decision"
        ],
        "properties": {
          "capability": {
            "type": "string"
          },
          "subject": {
            "type": "string"
          },
          "resource": {
            "type": "string"
          },
          "decision": {
            "type": "string",
            "enum": [
              "allow",
              "deny",
              "ask_user",
              "dry_run"
            ]
          },
          "reason_code": {
            "type": "string"
          }
        }
      }
    },
    "actions": {
      "type": "array",
      "items": {
        "type": "object",
        "required": [
          "action_id",
          "tool_name",
          "state_changing",
          "timestamp_ms"
        ],
        "properties": {
          "action_id": {
            "type": "string"
          },
          "tool_name": {
            "type": "string"
          },
          "state_changing": {
            "type": "boolean"
          },
          "precondition_digest": {
            "type": "string"
          },
          "result_digest": {
            "type": "string"
          },
          "evidence_refs": {
            "type": "array",
            "items": {
              "type": "string"
            }
          },
          "timestamp_ms": {
            "type": "number"
          },
          "parent_action_id": {
            "type": "string"
          },
          "causal_chain_id": {
            "type": "string"
          },
          "tool_descriptor_digest": {
            "type": "string"
          },
          "server_card_digest": {
            "type": "string"
          },
          "scope_lease_id": {
            "type": "string"
          },
          "approval_context_hash": {
            "type": "string"
          },
          "input_taint_labels": {
            "type": "array",
            "items": {
              "type": "string"
            }
          },
          "output_taint_labels": {
            "type": "array",
            "items": {
              "type": "string"
            }
          },
          "memory_read_refs": {
            "type": "array",
            "items": {
              "type": "string"
            }
          },
          "memory_write_refs": {
            "type": "array",
            "items": {
              "type": "string"
            }
          },
          "pre_state_digest": {
            "type": "string"
          },
          "post_state_digest": {
            "type": "string"
          }
        }
      }
    },
    "verifier_results": {
      "type": "array",
      "items": {
        "type": "object",
        "required": [
          "verifier_id",
          "passed"
        ],
        "properties": {
          "verifier_id": {
            "type": "string"
          },
          "passed": {
            "type": "boolean"
          },
          "score": {
            "type": "number"
          },
          "claim_ids": {
            "type": "array",
            "items": {
              "type": "string"
            }
          }
        }
      }
    },
    "budget_ledger": {
      "type": "object",
      "description": "Per-run budget consumption vs limits",
      "properties": {
        "token_budget": {
          "type": "object",
          "required": [
            "spent"
          ],
          "properties": {
            "limit": {
              "type": "number"
            },
            "spent": {
              "type": "number"
            }
          }
        },
        "latency_budget": {
          "type": "object",
          "required": [
            "actual_ms"
          ],
          "properties": {
            "limit_ms": {
              "type": "number"
            },
            "actual_ms": {
              "type": "number"
            }
          }
        },
        "tool_budget": {
          "type": "object",
          "required": [
            "spent"
          ],
          "properties": {
            "limit": {
              "type": "number"
            },
            "spent": {
              "type": "number"
            }
          }
        },
        "risk_budget": {
          "type": "object",
          "required": [
            "spent"
          ],
          "properties": {
            "limit": {
              "type": "number"
            },
            "spent": {
              "type": "number"
            }
          }
        },
        "retry_budget": {
          "type": "object",
          "required": [
            "spent"
          ],
          "properties": {
            "limit": {
              "type": "number"
            },
            "spent": {
              "type": "number"
            }
          }
        },
        "human_approval_budget": {
          "type": "object",
          "required": [
            "spent"
          ],
          "properties": {
            "limit": {
              "type": "number"
            },
            "spent": {
              "type": "number"
            }
          }
        }
      }
    },
    "created_at_ms": {
      "type": "number"
    },
    "run_context": {
      "type": "object",
      "properties": {
        "agent_id": {
          "type": "string"
        },
        "agent_version": {
          "type": "string"
        },
        "subagent_id": {
          "type": "string"
        },
        "delegation_chain": {
          "type": "array",
          "items": {
            "type": "string"
          }
        },
        "environment_digest": {
          "type": "string"
        },
        "dependency_lock_digest": {
          "type": "string"
        }
      }
    },
    "user_id": {
      "type": "string",
      "description": "Optional end-user / principal the run acted on behalf of (additive, aep/v0.3+)."
    },
    "subject_id": {
      "type": "string",
      "description": "Optional agent subject identity for the run (additive, aep/v0.3+)."
    },
    "authorized_by": {
      "type": "string",
      "description": "Principal that granted or approved the authority this run exercised, when that party differs from user_id (additive, aep/v0.5+). Distinguishes the party who initiated from the party who authorized; omit when the same principal did both. Per-action human-approval evidence continues to live in actions[].approval_context_hash."
    },
    "authority_origin": {
      "type": "string",
      "enum": [
        "subject_consented",
        "admin_assigned",
        "org_wide",
        "unknown"
      ],
      "description": "How the principal named in user_id obtained the authority this run exercised, as observable at issuance/consent time (additive, aep/v0.5+). subject_consented = the principal interactively approved; admin_assigned = an administrator created the grant and no principal was ever prompted; org_wide = consent granted on behalf of an organization. unknown = the producer observed the attribution but the identity provider does not expose grant origin — the honest state for most current IdPs, and the value that stops a consumer reading user_id as stronger evidence than it is. Absent = the producer makes no claim. Motivating case (OWASP www-project-mcp-top-10 #44/#50): two grants byte-identical in every identity claim, one subject-consented and one admin-assigned — user_id alone cannot separate them; this field can."
    },
    "attribution_backing": {
      "type": "string",
      "enum": [
        "operator_asserted",
        "principal_key_signed",
        "qualified_signature",
        "unknown"
      ],
      "description": "Machine-checkable statement of what backs the human attribution of this record (additive, aep/v0.5+). Grades the evidence behind the attribution — operator_asserted = operator assertion only, no signature by a key under the principal's control; principal_key_signed = backed by such a signature; qualified_signature = backed by a qualified identity-proofed signature (e.g. QES validated against an EU Trusted List); unknown = attribution present but ungradeable. NOT a claim that the runtime authorization predicate was correctly constrained, and not a scope statement. Producers MUST NOT report a stronger grade than the evidence supports; where ordering matters (run_attribution_backing_floor) unknown is weaker than operator_asserted."
    },
    "run_attribution_backing_floor": {
      "type": "string",
      "enum": [
        "operator_asserted",
        "principal_key_signed",
        "qualified_signature",
        "unknown"
      ],
      "description": "Per-run aggregate: the weakest attribution backing present across the authorizations this run relied on (additive, aep/v0.5+). Shares the attribution_backing vocabulary. Total order, weakest to strongest: unknown < operator_asserted < principal_key_signed < qualified_signature. The floor MUST NOT round up — one strong grant must not mask unbacked authorizations inside the same tamper-evident record. Absent = the producer emits no attribution_backing values and makes no grading claim at all."
    },
    "side_effect_class": {
      "type": "string",
      "enum": [
        "read",
        "mutate-local",
        "mutate-external",
        "network-egress",
        "unknown"
      ],
      "description": "Per-record side-effect classification (additive, aep/v0.3+). Shares one vocabulary with run_side_effect_class_max; reconciles wasmagent-js and trace-pipeline forks."
    },
    "run_side_effect_class_max": {
      "type": "string",
      "enum": [
        "read",
        "mutate-local",
        "mutate-external",
        "network-egress",
        "unknown"
      ],
      "description": "Per-run aggregate: the highest side-effect class observed across the whole run (additive, aep/v0.3+). Shares the side_effect_class vocabulary."
    },
    "recording_mode": {
      "type": "string",
      "enum": [
        "full",
        "delta",
        "validation"
      ],
      "description": "Retention depth of captured evidence for this run (additive, aep/v0.3+). Controls how much of what was observed the producer chose to keep — NOT a claim about observation scope or coverage. full = complete provenance (all observed data retained); delta = before/after state digests only; validation = action metadata only (minimum retention). A narrow-scope monitor and a wide-scope monitor produce identical recording_mode values; observation scope is a property of the producing monitor's configuration, not of this record."
    },
    "argument_drift": {
      "type": "object",
      "description": "Detected drift between an action's declared arguments and the arguments used at runtime (additive, aep/v0.3+).",
      "properties": {
        "tool_name": {
          "type": "string"
        },
        "declared_digest": {
          "type": "string"
        },
        "actual_digest": {
          "type": "string"
        },
        "diff_summary": {
          "type": "string"
        },
        "drifted_args": {
          "type": "array",
          "items": {
            "type": "string"
          }
        }
      },
      "additionalProperties": true
    },
    "dsse_envelope": {
      "description": "DSSE envelope (aep/v0.4+). Present when the producer signed via DSSE PAE; the legacy signature field is derived from the envelope's signatures[0] for backward compatibility. payload is base64-encoded; payloadType uses DSSE PayloadType format.",
      "type": "object",
      "required": [
        "payloadType",
        "payload",
        "signatures"
      ],
      "properties": {
        "payloadType": {
          "type": "string"
        },
        "payload": {
          "type": "string",
          "contentEncoding": "base64"
        },
        "signatures": {
          "type": "array",
          "minItems": 1,
          "items": {
            "type": "object",
            "required": [
              "keyid",
              "sig"
            ],
            "properties": {
              "keyid": {
                "type": "string"
              },
              "sig": {
                "type": "string"
              }
            }
          }
        }
      }
    },
    "signature": {
      "type": "object",
      "description": "Optional tamper-evident signature. Stays OPTIONAL in every released schema version (aep/v0.1-v0.5); tightening it to required is a breaking change (CONTRACT-CHANGE-PROCESS.md section 3) that needs an org RFC before it can land - do not silently add it to the 'required' array.",
      "required": [
        "alg",
        "key_id",
        "sig"
      ],
      "properties": {
        "alg": {
          "type": "string"
        },
        "key_id": {
          "type": "string"
        },
        "sig": {
          "type": "string"
        },
        "bundle": {
          "type": "object"
        },
        "transparency_log_ref": {
          "type": "string"
        }
      }
    }
  }
}
