{
  "schema_version": "aep/v0.4",
  "run_id": "run-v04-dsse",
  "created_at_ms": 1754000000000,
  "actions": [],
  "dsse_envelope": {
    "payloadType": "application/vnd.wasmagent.aep+json",
    "payload": "eyJzY2hlbWFfdmVyc2lvbiI6ImFlcC92MC40In0=",
    "signatures": [
      {
        "keyid": "aep-signing-key-1",
        "sig": "Zm9v"
      }
    ]
  },
  "signature": {
    "alg": "ed25519",
    "key_id": "aep-signing-key-1",
    "sig": "Zm9v"
  }
}
