{
  "schema_version": "aep/v0.2",
  "run_id": "run-refs",
  "trace_id": "trace-refs-001",
  "runtime_version": "wasmagent-js@1.20.0",
  "policy_bundle_digest": "sha256:policy",
  "tool_manifest_digest": "sha256:manifest",
  "mcp_server_card_digest": null,
  "created_at_ms": 1737600000000,
  "input_refs": [
    {
      "uri": "file:///workspace/src/app.ts",
      "digest": "sha256:in1",
      "taint_labels": ["user-input"]
    }
  ],
  "output_refs": [
    {
      "uri": "file:///workspace/dist/app.js",
      "digest": "sha256:out1",
      "redaction_profile": "default"
    }
  ]
}
