{
  "schema_version": "aep/v0.5",
  "run_id": "run-signed",
  "trace_id": "0a1b2c3d4e5f6071",
  "dsse_envelope": {
    "payloadType": "application/vnd.in-toto+json",
    "payload": "eyJfdHlwZSI6Imh0dHBzOi8vaW4tdG90by5pby9TdGF0ZW1lbnQvdjEiLCJwcmVkaWNhdGUiOnsiYWN0aW9ucyI6W3siYWN0aW9uX2lkIjoiY3R4LTciLCJyZWNvcmRpbmdfbW9kZSI6InZhbGlkYXRpb24iLCJzaWRlX2VmZmVjdF9jbGFzcyI6InJlYWQiLCJzdGF0ZV9jaGFuZ2luZyI6ZmFsc2UsInRpbWVzdGFtcF9tcyI6MTcwMDAwMDAwMDAwMiwidG9vbF9uYW1lIjoiR0VUIC9tY3AvcmVzb3VyY2VzIn1dLCJjcmVhdGVkX2F0X21zIjoxNzAwMDAwMDAwMDAyLCJydW5faWQiOiJydW4tc2lnbmVkIiwic2NoZW1hX3ZlcnNpb24iOiJhZXAvdjAuNSIsInRyYWNlX2lkIjoiMGExYjJjM2Q0ZTVmNjA3MSJ9LCJwcmVkaWNhdGVUeXBlIjoiaHR0cHM6Ly93YXNtYWdlbnQuZGV2L2F0dGVzdGF0aW9ucy9hZXAvdjAuNCIsInN1YmplY3QiOlt7ImRpZ2VzdCI6eyJzaGEyNTYiOiI3YWMwMGM1YmM0NjkyMmFjZjlmNjgyYmYxOGE3ZjlmMDg0OTM3MWM3OTFhNDllYzA4MmQ1YzE1YWE1MjlkMWM0In0sIm5hbWUiOiJ1cm46d2FzbWFnZW50OnJ1bjpydW4tc2lnbmVkIn1dfQ==",
    "signatures": [
      {
        "keyid": "ci-sample-key",
        "sig": "Zm4rxTy2URewymAPM5u9GlYuDaarYLPQ6RDP3+Bo1ODkeaDDPS2YsaGjbp8cKsMxMKfHPFVC298uKXtZxX3sBQ=="
      }
    ]
  },
  "actions": [
    {
      "action_id": "ctx-7",
      "tool_name": "GET /mcp/resources",
      "state_changing": false,
      "timestamp_ms": 1700000000002,
      "recording_mode": "validation",
      "side_effect_class": "read"
    }
  ],
  "created_at_ms": 1700000000002,
  "signature": {
    "alg": "ed25519",
    "key_id": "ci-sample-key",
    "sig": "Zm4rxTy2URewymAPM5u9GlYuDaarYLPQ6RDP3+Bo1ODkeaDDPS2YsaGjbp8cKsMxMKfHPFVC298uKXtZxX3sBQ=="
  }
}