{
  "schema_version": "aep/v0.2",
  "run_id": "run-capabilities",
  "trace_id": "trace-capabilities-001",
  "parent_trace_id": null,
  "repo_commit": "deadbeef",
  "runtime_version": "wasmagent-js@1.20.0",
  "created_at_ms": 1737600000000,
  "capability_decisions": [
    {
      "capability": "fs.write",
      "subject": "agent-1",
      "resource": "/tmp/out.txt",
      "decision": "allow"
    },
    {
      "capability": "net.request",
      "subject": "agent-1",
      "resource": "https://example.com",
      "decision": "deny",
      "reason_code": "no_network_scope"
    }
  ],
  "actions": [
    {
      "action_id": "a1",
      "tool_name": "write_file",
      "state_changing": true,
      "precondition_digest": "sha256:pre",
      "result_digest": "sha256:post",
      "evidence_refs": ["ev-1"],
      "parent_action_id": "a0",
      "causal_chain_id": "chain-1",
      "timestamp_ms": 1737600000100
    }
  ],
  "verifier_results": [
    {
      "verifier_id": "symkernel-cel",
      "passed": true,
      "score": 1.0,
      "claim_ids": ["claim-1"]
    }
  ],
  "signature": {
    "alg": "ed25519",
    "key_id": "k1",
    "sig": "base64sig=="
  }
}
